Title,Employer,Location,Published,Job Type,URL,Description
2 doctoral fellowships in architecture and technology,eth zürich,Switzerland,Published 2 months ago,PhD,https://academicpositions.com/ad/eth-zurich/2024/2-doctoral-fellowships-in-architecture-and-technology/223782,2 doctoral fellowships in architecture and technologythe architecture & technology (a&t) doctoral programme is looking for exceptional candidates to join our group of 50+ international doctoral stu...
data-driven modelling methods for digital twins of circular production systems,ku leuven,Belgium,Published 2 months ago,PhD,https://academicpositions.com/ad/ku-leuven/2024/data-driven-modelling-methods-for-digital-twins-of-circular-production-systems/223830,the ku leuven research group within the department of mechanical engineering has significant experience in manufacturing systems. the main industrial applications are discrete manufacturing process...
phd position in novel “virtual therapist” control to tailor the robotic support to the person’s contribution,university of twente,The netherlands,Published 6 hours ago,PhD,https://academicpositions.com/ad/university-of-twente/2024/phd-position-in-novel-virtual-therapist-control-to-tailor-the-robotic-support-to-the-persons-contribution/226378,job descriptionadjusting the support provided by a robotic gait trainer to match each person’s performance is a challenging task for therapists due to the numerous parameters that need tuning and t...
engd position: optimal design and manufacturing methodology of electrolyser bipolar plates,university of twente,The netherlands,Published 6 hours ago,PhD,https://academicpositions.com/ad/university-of-twente/2024/engd-position-optimal-design-and-manufacturing-methodology-of-electrolyser-bipolar-plates/226379,job descriptionthe chair of nonlinear solid mechanics within the faculty of engineering technology has an opening for an engd position focused on developing a numerical design tool to predict the m...
doctoral student in sprayed solar cells,kth royal institute of technology,Sweden,Published 1 month ago,PhD,https://academicpositions.com/ad/kth-royal-institute-of-technology/2024/doctoral-student-in-sprayed-solar-cells/223911,"project descriptionthird-cycle subject: fibre and polymer sciencein our group, we focus on organic and electronics and solar cells based on sustainable, bio-based materials. starting from the thinn..."
upcoming phd positions in condensed matter science,max planck institute for solid state research,Germany,Published 1 month ago,PhD,https://academicpositions.com/ad/max-planck-institute-for-solid-state-research/2024/upcoming-phd-positions-in-condensed-matter-science/223953,thanks to all the academics who submitted their application!the application deadline has passed and the selection process started. more information for the new call-out will come up later in january and the autumn 2025. stay tuned!there are two ap...
assistant professor (tenure-track) - mechanical and industrial engineering (2 positions),louisiana state university,United states,Published 1 month ago,Assistant / Associate Professor,https://academicpositions.com/ad/louisiana-state-university/2024/assistant-professor-tenure-track-mechanical-and-industrial-engineering-2-positions/223954,louisiana state university (lsu) in baton rouge invites applications and nominations for two tenure-track faculty positions in the department of mechanical and industrial engineering (mie) to complement its strategic research application areas of ...
"doctoral researcher (factory automation, robotics and ai)",tampere university,Finland,Published 6 hours ago,PhD,https://academicpositions.com/ad/tampere-university/2024/doctoral-researcher-factory-automation-robotics-and-ai/226381,"tampere university and tampere university of applied sciences create a unique environment for multidisciplinary, inspirational and high-impact research and education. our universities community has its competitive edges in technology, health and s..."
"fully funded phd positions in astronomy, biology, computer science, chemistry & materials, data science & scientific computing, earth science, mathematics, neuroscience, and physics",institute of science and technology austria (ista),Austria,Published 1 month ago,PhD,https://academicpositions.com/ad/institute-of-science-and-technology-austria-ista/2024/fully-funded-phd-positions-in-astronomy-biology-computer-science-chemistry-materials-data-science-scientific-computing-earth-science-mathematics-neuroscience-and-physics/223961,"the institute of science and technology austria (ista) is looking for highly qualified candidates with bachelor’s or master’s degrees to apply for our phd program. we offer fully funded phd positions in astronomy, biology, computer science, chemis..."
dc12 impact assessment of changing nature of medical electromagnetic environment,eindhoven university of technology,The netherlands,Published 1 month ago,PhD,https://academicpositions.com/ad/eindhoven-university-of-technology/2024/dc12-impact-assessment-of-changing-nature-of-medical-electromagnetic-environment/223970,"position phd-studentirène curie fellowship nodepartment(s) electrical engineeringfte 1,0date off 10/12/2024reference number v36.7775job descriptionapplications are invited for the phd position (“doctoral candidates”, dcs) to be funded by the marie..."
dc7 phd in-situ evaluation of the emi footprint of large interconnected systems,eindhoven university of technology,The netherlands,Published 1 month ago,PhD,https://academicpositions.com/ad/eindhoven-university-of-technology/2024/dc7-phd-in-situ-evaluation-of-the-emi-footprint-of-large-interconnected-systems/223972,"position phd-studentirène curie fellowship nodepartment(s) electrical engineeringfte 1,0date off 10/12/2024reference number v36.7774job descriptionapplications are invited for the phd position (“doctoral candidates”, dcs) to be funded by the marie..."
"phd student - department of materials, textiles and chemical engineering",ghent university,Belgium,Published 5 hours ago,PhD,https://academicpositions.com/ad/ghent-university/2024/phd-student-department-of-materials-textiles-and-chemical-engineering/226383,"last application date jan 31, 2025 00:00department tw11 - department of materials, textiles and chemical engineeringcontract limited durationdegree master in engineeringoccupancy rate 100%vacancy type research staffjob descriptionabout ghent unive..."
"doctoral fellow - department of european, public and international law",ghent university,Belgium,Published 6 days ago,PhD,https://academicpositions.com/ad/ghent-university/2024/doctoral-fellow-department-of-european-public-and-international-law/226175,"last application date jan 12, 2025 00:00department re22 - department of european, public and international lawcontract limited durationoccupancy rate 100%vacancy type research staffabout the projectthe erc research project “migjust: global migrati..."
phd positions in studies of liquid-liquid interface dynamics using flat jets,epfl école polytechnique fédérale de lausanne,Switzerland,Published 1 month ago,PhD,https://academicpositions.com/ad/ecole-polytechnique-federale-de-lausanne-epfl/2024/phd-positions-in-studies-of-liquid-liquid-interface-dynamics-using-flat-jets/224022,fully funded phd positions are available in the group of andreas osterwalder (https://www.epfl.ch/labs/gr-ost/) at the ecole polytechnique fédérale de lausanne (epfl) in switzerland.we are using liquid flat jets (lfj) to study liquid-liquid interf...
"phd student - department of materials, textiles and chemical engineering",ghent university,Belgium,Published 5 hours ago,PhD,https://academicpositions.com/ad/ghent-university/2024/phd-student-department-of-materials-textiles-and-chemical-engineering/226384,"last application date jan 31, 2025 00:00department tw11 - department of materials, textiles and chemical engineeringcontract limited durationdegree master in engineeringoccupancy rate 100%vacancy type research staffjob descriptionabout ghent unive..."
"phd student - department of materials, textiles and chemical engineering",ghent university,Belgium,Published 5 hours ago,PhD,https://academicpositions.com/ad/ghent-university/2024/phd-student-department-of-materials-textiles-and-chemical-engineering/226385,"last application date jan 31, 2025 00:00department tw11 - department of materials, textiles and chemical engineeringcontract limited durationdegree master in engineeringoccupancy rate 100%vacancy type research staffjob descriptionabout ghent unive..."
phd position: friction in architected materials,eth zürich,Switzerland,Published 1 month ago,PhD,https://academicpositions.com/ad/eth-zurich/2024/phd-position-friction-in-architected-materials/224042,phd position: friction in architected materialsthe computational mechanics of building materials in the institute for building materials at eth zurich has an opening for a phd student infriction i...
phd student to study the formation kinetics of calcium silicate hydrates,paul scherrer institute (psi),Switzerland,Published 4 days ago,PhD,https://academicpositions.com/ad/paul-scherrer-institute/2024/phd-student-to-study-the-formation-kinetics-of-calcium-silicate-hydrates/226301,"the paul scherrer institute psi is the largest research institute for natural and engineering sciences within switzerland. we perform cutting-edge research in the fields of future technologies, ene..."
phd and msc positions at the faculty of biology in the technion - israel institute of technology,technion - israel institute of technology,Israel,Published 1 month ago,PhD,https://academicpositions.com/ad/technion-israel-institute-technology/2024/join-the-faculty-of-biology-at-the-technion-israel-institute-of-technology/224088,"the technion, located in haifa, israel, is a world-renowned institution known for its excellence in science and technology. ranked among the top universities globally, it fosters groundbreaking research and innovation.the faculty of biology offers..."
mqv & max planck imprs doctoral fellowships in quantum science and technology: fall 2025 open call,mqv & imprs quantum education program,Germany,Published 1 month ago,PhD,https://academicpositions.com/ad/mqv-imprs-quantum-education-program/2024/mqv-max-planck-imprs-doctoral-fellowships-in-quantum-science-and-technology-fall-2025-open-call/224095,the international max planck research school for quantum science and technology (imprs-qst) and the munich quantum valley (mqv) gladly announce the open call for several fully funded phd fellowships starting from summer-fall 2025. we invite passio...
phd position: automated thermodynamics lab for molecular and process design,eth zürich,Switzerland,Published 1 week ago,PhD,https://academicpositions.com/ad/eth-zurich/2024/phd-position-automated-thermodynamics-lab-for-molecular-and-process-design/226011,phd position: automated thermodynamics lab for molecular and process designthe energy and process systems engineering (epse) group at eth zürich is looking for a doctoral student to work experiment...
industrial phd on “thermally enhanced antenna arrays for mm-wave applications”,eindhoven university of technology,The netherlands,Published 1 month ago,PhD,https://academicpositions.com/ad/eindhoven-university-of-technology/2024/industrial-phd-on-thermally-enhanced-antenna-arrays-for-mm-wave-applications/224250,"prestigious industrial phd student position on “thermally enhanced antenna arrays for mm-wave applications” department of research and development, the antenna company em group, department of electrical engineering, eindhoven university of technol..."
phd position in dissolution of mg-based silicate minerals for carbon sequestration,eth zürich,Switzerland,Published 1 month ago,PhD,https://academicpositions.com/ad/eth-zurich/2024/phd-position-in-dissolution-of-mg-based-silicate-minerals-for-carbon-sequestration/224291,phd position in dissolution of mg-based silicate minerals for carbon sequestrationwe are looking for a motivated phd student to work on the dissolution of mg-based silicate minerals for carbon sequ...
phd position in the field of electronics and/or electromagnetic compatibility,graz university of technology,Austria,Published 1 month ago,Research assistant,https://academicpositions.com/ad/graz-university-of-technology/2024/phd-position-in-the-field-of-electronics-and-or-electromagnetic-compatibility/224303,publication date 23.05.2024application deadline 31.12.2024job category scientific staffjob profile university project assistantemployment start as soon as possiblecontract duration 48 mths.hours per week 40 h/wemployment typetemporaryresponsibilit...
phd position in computational biology on the discovery of multimodal biomarkers,empa,Switzerland,Published 1 month ago,PhD,https://academicpositions.com/ad/empa/2024/phd-position-in-computational-biology-on-the-discovery-of-multimodal-biomarkers/224304,"materials science and technology are our passion. with our cutting-edge research, empa's around 1,100 employees make essential contributions to the well-being of society for a future worth living. ..."
"open phd positions in business administration, economics and finance",stockholm school of economics (sse),Sweden,Published 4 hours ago,PhD,https://academicpositions.com/ad/stockholm-school-of-economics-sse/2024/open-phd-positions-in-business-administration-economics-and-finance/226394,"the stockholm school of economics has been ranked by the financial times as one of the best business schools in europe and enjoys a strong international reputation. world-class research forms the foundation of sse’s educational offering, which inc..."
the gynecology research unit of the ucl is looking for a dynamic young scientist wishing to do a phd thesis - gonadotoxicity: effect of chemotherapeutic agents on fertility,université catholique de louvain,Belgium,Published 2 hours ago,PhD,https://academicpositions.com/ad/universite-catholique-de-louvain/2024/the-gynecology-research-unit-of-the-ucl-is-looking-for-a-dynamic-young-scientist-wishing-to-do-a-phd-thesis-gonadotoxicity-effect-of-chemotherapeutic-agents-on-fertility/226405,the gynecology research unit of the ucl is looking fora dynamic young scientist wishing to do a phd thesissubject: gonadotoxicity: effect of chemotherapeutic agents on fertilityfunding: fonds national de recherche scientifique (fnrs)-televie inter...
phd-student: physical learning machines,amolf,The netherlands,Published 1 month ago,PhD,https://academicpositions.com/ad/amolf/2024/phd-student-physical-learning-machines/224131,work activities the learning machines group seeks motivated phd students to join our team working on learning in physical systems. what are learning machines? imagine your favorite artificial intel...
doctoral (phd) student position in psychiatric genetics with focus on depression and eating disorders,karolinska institutet,Sweden,Published 1 week ago,PhD,https://academicpositions.com/ad/karolinska-institutet/2024/doctoral-phd-student-position-in-psychiatric-genetics-with-focus-on-depression-and-eating-disorders/226012,do you want to contribute to top quality medical research? to be a doctoral student means to devote oneself to a research project under supervision of experienced researchers and following an indiv...
"phds in economics, history, law and political and social sciences – up to 130 scholarships available",european university institute (eui),Italy,Published 1 month ago,PhD,https://academicpositions.com/ad/european-university-institute-eui/2024/phds-in-economics-history-law-and-political-and-social-sciences-up-to-130-scholarships-available/224161,"the european university institute (eui) offers four-year fully-funded phd programmes in economics, history, law and political and social sciences. up to 130 scholarships are available for entry in september 2025, covering tuition and providing a m..."
phd position in atomic and molecular quantum magnetism,empa,Switzerland,Published 1 month ago,PhD,https://academicpositions.com/ad/empa/2024/phd-position-in-atomic-and-molecular-quantum-magnetism/224169,"materials science and technology are our passion. with our cutting-edge research, empa's around 1,100 employees make essential contributions to the well-being of society for a future worth living. ..."
"phd position in archaeological science at ku leuven, laboratory for archaeometry",ku leuven,Belgium,Published 1 month ago,PhD,https://academicpositions.com/ad/ku-leuven/2024/phd-position-in-archaeological-science-at-ku-leuven-laboratory-for-archaeometry/224171,"ku leuven is a leading european research university located in leuven, belgium, consistently ranked among the top universities worldwide. with a rich history dating back to 1425, ku leuven is renow..."
decision support methods for distribution networks with telemetry data,ku leuven,Belgium,Published 1 month ago,PhD,https://academicpositions.com/ad/ku-leuven/2024/decision-support-methods-for-distribution-networks-with-telemetry-data/224172,"you will be working at the ghent campus of ku leuven, as part of the electa - ghent division. you will join a new team led by the recently appointed prof. vanin, which is part of a larger, young, i..."
university assistant prae-doc (all genders) 30 hours/week | limited to 4 years - institute of logic and computation,tu wien,Austria,Published 4 days ago,PhD,https://academicpositions.com/ad/tu-wien/2024/university-assistant-prae-doc-all-genders-30-hoursweek-limited-to-4-years-institute-of-logic-and-computation/226261,"tu wien is austria's largest institution of research and higher education in the fields of technology and natural sciences. with over 26,000 students and more than 4000 scientists, research, teachi..."
phd candidate for post-transcriptional rna regulation,the hebrew university of jerusalem,Israel,Published 1 month ago,PhD,https://academicpositions.com/ad/the-hebrew-university-of-jerusalem/2024/phd-candidate-for-post-transcriptional-rna-regulation/224195,"about our campus: hebrew university’s edmond j. safra campus on givat ram, in jerusalem, is a vibrant hub of academic and research excellence nestled in the heart of jerusalem. our modern campus boasts state-of-the-art lab facilities, world-renown..."
"phd candidate for computational approaches for studying animal behavior, personality, and emotions",the hebrew university of jerusalem,Israel,Published 1 month ago,PhD,https://academicpositions.com/ad/the-hebrew-university-of-jerusalem/2024/phd-candidate-for-computational-approaches-for-studying-animal-behavior-personality-and-emotions/224197,"about our campus: rehovot campus (rehovot) and mt. scopus campus (jerusalem). the position will be based across two campuses: the robert h. smith faculty of agriculture, food and environment on the hebrew university’s beautiful rehovot campus. reh..."
phd candidate in vehicular communications,university of luxembourg,Luxembourg,Published 1 month ago,PhD,https://academicpositions.com/ad/university-of-luxembourg/2024/phd-candidate-in-vehicular-communications/224204,"about the sntthe university of luxembourg is an international research university with a distinctly multilingual and interdisciplinary character.the interdisciplinary centre for security, reliabili..."
phd position in organic chemistry/radiochemistry,eth zürich,Switzerland,Published 1 month ago,PhD,https://academicpositions.com/ad/eth-zurich/2024/phd-position-in-organic-chemistryradiochemistry/224413,phd position in organic chemistry/radiochemistrythe center for radiopharmaceutical sciences (crs) at eth zurich develops new innovative radiolabelled pharmaceuticals for diagnosis and therapy. it o...
phd position: molecular structure of electrode-electrolyte interfaces in electrochemistry,university of twente,The netherlands,Published 4 days ago,PhD,https://academicpositions.com/ad/university-of-twente/2024/phd-position-molecular-structure-of-electrode-electrolyte-interfaces-in-electrochemistry/226300,job descriptionenhance the fundamental understanding of the structure of electrode-electrolyte interfaces and their response to applied voltages and imposed currents. perform high resolution atomic...
advanced process analytics researching the formation and structure of unique lignin oligomers – joint phd position ku leuven – maastricht university,ku leuven,Belgium,Published 1 month ago,PhD,https://academicpositions.com/ad/ku-leuven/2024/advanced-process-analytics-researching-the-formation-and-structure-of-unique-lignin-oligomers-joint-phd-position-ku-leuven-maastricht-university/224420,"the mission statement of the csce (sustainable catalysis and engineering), led by prof. dr. bert sels, is to produce knowledge to foster a better understanding of the role of heterogeneous catalysi..."
phd position: computational modeling of auger capture rates,leiden university,The netherlands,Published 1 month ago,PhD,https://academicpositions.com/ad/leiden-university/2024/phd-position-computational-modeling-of-auger-capture-rates/224454,phd position: computational modeling of auger capture ratesintroduction tekstthe faculty of science leiden and the leiden institute of chemistry are looking for a phd student to work on a project related to around plasma-surface interactions. unli...
phd research scholar positions – department of strategy and management,nhh norwegian school of economics,Norway,Published 1 month ago,PhD,https://academicpositions.com/ad/norwegian-school-of-economics-nhh/2024/phd-research-scholar-positions-department-of-strategy-and-management/224460,"about nhhnhh norwegian school of economics is a triple crown accredited business school and among the best-ranked institutions in europe. we are internationally recognised for our research environment, and we educate the leaders of the future. nhh..."
phd research scholar positions – department of finance,nhh norwegian school of economics,Norway,Published 1 month ago,PhD,https://academicpositions.com/ad/norwegian-school-of-economics-nhh/2024/phd-research-scholar-positions-department-of-finance/224461,"about nhhnhh norwegian school of economics is a triple crown accredited business school and among the best-ranked institutions in europe. we are internationally recognised for our research environment, and we educate the leaders of the future. nhh..."
phd research scholar positions – department of economics,nhh norwegian school of economics,Norway,Published 1 month ago,PhD,https://academicpositions.com/ad/norwegian-school-of-economics-nhh/2024/phd-research-scholar-positions-department-of-economics/224463,"about nhhnhh norwegian school of economics is a triple crown accredited business school and among the best-ranked institutions in europe. we are internationally recognised for our research environment, and we educate the leaders of the future. nhh..."
"phd research scholar positions – department of accounting, auditing and law",nhh norwegian school of economics,Norway,Published 1 month ago,PhD,https://academicpositions.com/ad/norwegian-school-of-economics-nhh/2024/phd-research-scholar-positions-department-of-accounting-auditing-and-law/224464,"about nhhnhh norwegian school of economics is a triple crown accredited business school and among the best-ranked institutions in europe. we are internationally recognised for our research environment, and we educate the leaders of the future. nhh..."
phd research scholar positions – department of business and management science,nhh norwegian school of economics,Norway,Published 1 month ago,PhD,https://academicpositions.com/ad/norwegian-school-of-economics-nhh/2024/phd-research-scholar-positions-department-of-business-and-management-science/224466,"about nhhnhh norwegian school of economics is a triple crown accredited business school and among the best-ranked institutions in europe. we are internationally recognised for our research environment, and we educate the leaders of the future. nhh..."
phd position on multi-constituent nanopastes for sinter-bonding,empa,Switzerland,Published 1 month ago,PhD,https://academicpositions.com/ad/empa/2024/phd-position-on-multi-constituent-nanopastes-for-sinter-bonding/224487,"materials science and technology are our passion. with our cutting-edge research, empa's around 1,100 employees make essential contributions to the well-being of society for a future worth living. ..."
phd position in computer vision,university of bern,Switzerland,Published 3 weeks ago,PhD,https://academicpositions.com/ad/university-of-bern/2024/phd-position-in-computer-vision/224355,"positions: we have an opening for a phd position in computer vision. the main research topic of this position is 3d object reconstruction and animation from real videos. this project is based on unsupervised learning, that is, it uses datasets tha..."
phd position in decarbonizing the future of the chemical industry,eth zürich,Switzerland,Published 1 week ago,PhD,https://academicpositions.com/ad/eth-zurich/2024/phd-position-in-decarbonizing-the-future-of-the-chemical-industry/226096,phd position in decarbonizing the future of the chemical industrythe ecological systems design group at eth zürich is an internationally leading research group in the field of modelling and improvi...
phd position: putting explainable ai to work to support cultural heritage,radboud university,The netherlands,Published 1 week ago,PhD,https://academicpositions.com/ad/radboud-university/2024/phd-position-putting-explainable-ai-to-work-to-support-cultural-heritage/226078,"employment 1.0 ftegross monthly salary € 2,872 - € 3,670required background research university degreeorganizational unit faculty of scienceapplication deadline 05 january 2025are you curious about what happens behind the scenes at large libraries..."
