Title,Employer,Location,Published,Job Type,URL,Description
"assistant department translation, interpreting, and communication (28045)",ghent university,Belgium,Published 1 week ago,PhD,https://academicpositions.com/ad/ghent-university/2024/assistant-department-translation-interpreting-and-communication-28045/225889,"→ apply until 17/12/2024 (dd/mm/yyyy) 23:59 (brussels time) → faculty of arts and philosophy → department lw22 - translation, interpreting and communication → aap temporary appointment - 100% → number of openings: 1 → ..."
phd in biophysics: single-cell tracking in organoids,amolf,The netherlands,Published 1 week ago,PhD,https://academicpositions.com/ad/amolf/2024/phd-in-biophysics-single-cell-tracking-in-organoids/225902,"work activitiessummary – in this project, you will use advanced 3d imaging and ai-driven cell tracking to reveal the remarkable self-organization of cells within intestinal organoids. using a bioph..."
phd position in geochemistry of enhanced rock weathering,eth zürich,Switzerland,Published 1 week ago,PhD,https://academicpositions.com/ad/eth-zurich/2024/phd-position-in-geochemistry-of-enhanced-rock-weathering/225903,phd position in geochemistry of enhanced rock weatheringwe seek a phd student to develop and evaluate new geochemical tracers for the quantification of carbon dioxide removal and monitoring of pote...
phd position in soil biogeochemistry of enhanced rock weathering,eth zürich,Switzerland,Published 1 week ago,PhD,https://academicpositions.com/ad/eth-zurich/2024/phd-position-in-soil-biogeochemistry-of-enhanced-rock-weathering/225904,"phd position in soil biogeochemistry of enhanced rock weatheringwe seek a phd student to study the effects of enhanced rock weathering (erw) applications on biogeochemical cycles, plant growth and ..."
phd position on soil biogeochemical dynamics of alpine catchments,eth zürich,Switzerland,Published 1 week ago,PhD,https://academicpositions.com/ad/eth-zurich/2024/phd-position-on-soil-biogeochemical-dynamics-of-alpine-catchments/225905,phd position on soil biogeochemical dynamics of alpine catchmentswe seek a phd student to study the effects of soil redistribution on biogeochemical fluxes as well as carbon and nutrient storage in...
doctoral (phd) student position in clinical epidemiology with focus on maternal vaccination,karolinska institutet,Sweden,Published 1 week ago,PhD,https://academicpositions.com/ad/karolinska-institutet/2024/doctoral-phd-student-position-in-clinical-epidemiology-with-focus-on-maternal-vaccination/225912,do you want to contribute to top quality medical research? to be a doctoral student means to devote oneself to a research project under supervision of experienced researchers and following an indiv...
doctoral (phd) student position in neuroscience and ai,karolinska institutet,Sweden,Published 1 week ago,PhD,https://academicpositions.com/ad/karolinska-institutet/2024/doctoral-phd-student-position-in-neuroscience-and-ai/225913,do you want to contribute to top quality medical research? to be a doctoral student means to devote oneself to a research project under supervision of experienced researchers and following an indiv...
"phd or postdoctoral position, machine learning in the social sciences and humanities, 60%",university of basel,Switzerland,Published 5 days ago,PhD,https://academicpositions.com/ad/university-of-basel/2024/phd-or-postdoctoral-position-machine-learning-in-the-social-sciences-and-humanities-60/226215,the digital humanities lab at the university of basel is looking for a research assistant (with a master's or phd) as of 1st february 2025 or by arrangement. the digital humanities is an interdisci...
phd-student cardio-oncology with focus on translational research on the role of serpina3 in cancer therapy-related cardiovascular dysfunction (ctrcd),university of antwerp,Belgium,Published 1 week ago,PhD,https://academicpositions.com/ad/university-of-antwerp/2024/phd-student-cardio-oncology-with-focus-on-translational-research-on-the-role-of-serpina3-in-cancer-therapy-related-cardiovascular-dysfunction-ctrcd/225919,"let’s shape the future - university of antwerpthe university of antwerp is a dynamic, forward-thinking, european university. we offer an innovative academic education to more than 20000 students, c..."
phd position in nonprofit management,university of basel,Switzerland,Published 1 week ago,PhD,https://academicpositions.com/ad/university-of-basel/2024/phd-position-in-nonprofit-management/225938,"the center for philanthropy studies (ceps) is an interdisciplinary university institute for philanthropy at the university of basel. founded in 2008, the ceps combines internationally recognized re..."
phd position in environmental economics,university of basel,Switzerland,Published 1 week ago,PhD,https://academicpositions.com/ad/university-of-basel/2024/phd-position-in-environmental-economics/225942,the research group of public economics (prof. beat hintermann) of the faculty of business and economics at the university of basel invites applications for a phd position. start date: may 2025 (or...
full-time vacancy doctor-assistant spanish linguistics,ku leuven,Belgium,Published 1 week ago,PhD,https://academicpositions.com/ad/ku-leuven/2024/full-time-vacancy-doctor-assistant-spanish-linguistics/225958,"at the faculty of arts of ku leuven (campus leuven and campus kortrijk), there is a full-time vacancy for a postdoctoral assistant in the field of spanish linguistics. responsibilities to provide t..."
doctoral researcher (phd student) in process modelling,university of eastern finland,Finland,Published 1 week ago,PhD,https://academicpositions.com/ad/university-of-eastern-finland/2024/doctoral-researcher-phd-student-in-process-modelling/225960,the university of eastern finland is inviting applications for a doctoral researcher position in process modelling at the department of environmental and biological sciences on the kuopio campus. t...
phd candidate in free space qkd,university of luxembourg,Luxembourg,Published 1 week ago,PhD,https://academicpositions.com/ad/university-of-luxembourg/2024/phd-candidate-in-free-space-qkd/225962,"about the sntthe university of luxembourg is an international research university with a distinctly multilingual and interdisciplinary character.the interdisciplinary centre for security, reliabili..."
phd candidate in quantum software engineering,university of luxembourg,Luxembourg,Published 1 week ago,PhD,https://academicpositions.com/ad/university-of-luxembourg/2024/phd-candidate-in-quantum-software-engineering/225974,"about the sntthe university of luxembourg is an international research university with a distinctly multilingual and interdisciplinary character.the interdisciplinary centre for security, reliabili..."
phd candidate in gamification in cybersecurity,university of luxembourg,Luxembourg,Published 1 week ago,PhD,https://academicpositions.com/ad/university-of-luxembourg/2024/phd-candidate-in-gamification-in-cybersecurity/225977,"about the sntthe university of luxembourg is an international research university with a distinctly multilingual and interdisciplinary character.the interdisciplinary centre for security, reliabili..."
"doctoral researcher (electrochemistry, resource recovery, wastewater)",tampere university,Finland,Published 1 week ago,PhD,https://academicpositions.com/ad/tampere-university/2024/doctoral-researcher-electrochemistry-resource-recovery-wastewater/225998,"tampere university and tampere university of applied sciences create a unique environment for multidisciplinary, inspirational and high-impact research and education. our universities community has its competitive edges in technology, health and s..."
phd position in sustainable biogenic carbon pathways,eth zürich,Switzerland,Published 1 week ago,PhD,https://academicpositions.com/ad/eth-zurich/2024/phd-position-in-sustainable-biogenic-carbon-pathways/226000,phd position in sustainable biogenic carbon pathwaysthe ecological systems design group at eth zürich is an internationally leading research group in the field of modeling and improving the resourc...
doctoral fellow - department of basic and applied medical sciences,ghent university,Belgium,Published 1 week ago,PhD,https://academicpositions.com/ad/ghent-university/2024/doctoral-fellow-department-of-basic-and-applied-medical-sciences/226008,"last application date dec 31, 2024 00:00department ge33 - department of basic and applied medical sciencescontract limited durationdegree • a master’s degree (or expected completion) in medicine, pharmaceutical sciences, biomedical sciences, or ve..."
phd position on computational illumination optics,eindhoven university of technology,The netherlands,Published 1 week ago,PhD,https://academicpositions.com/ad/eindhoven-university-of-technology/2024/phd-position-on-computational-illumination-optics/226040,are you a mathematician interested in modeling and in developing numerical methods for partial differential equations? are you eager to use your mathematical skills to design optical systems for sustainable high-tech devices for billions of people...
phd position in hydrogen for hubs for circularity: system integration and optimization,university of twente,The netherlands,Published 1 week ago,PhD,https://academicpositions.com/ad/university-of-twente/2024/phd-position-in-hydrogen-for-hubs-for-circularity-system-integration-and-optimization/226045,"job descriptionjob descriptionas a researcher, you will have the opportunity to make a significant contribution to sustainable energy solutions by analyzing hydrogen technologies, developing decarb..."
phd student (f/m/x) wiss2411-14 | institute of zoology | aquatic chemical ecology,university of cologne,Germany,Published 1 week ago,PhD,https://academicpositions.com/ad/university-of-cologne/2024/phd-student-fmx-wiss2411-14-institute-of-zoology-aquatic-chemical-ecology/226046,institute of zoology | aquatic chemical ecology phd student (f/m/x) faculty of mathematics and natural sciences we are one of the largest and oldest universities in europe and one of the most impor...
doctoral researcher in mechanical engineering (hydrogen combustion and advanced engine simulation),university of oulu,Finland,Published 1 week ago,PhD,https://academicpositions.com/ad/university-of-oulu/2024/doctoral-researcher-in-mechanical-engineering-hydrogen-combustion-and-advanced-engine-simulation/226050,"the university of oulu is a multidisciplinary, international research university, with about 3,600 employees who produce new knowledge based on high-standards research and provide research based ed..."
"fully funded phd positions in innovation, policy and entrepreneurship thrust，society hub，hkust(gz)",hong kong university of science & technology (guangzhou),China,Published 1 week ago,PhD,https://academicpositions.com/ad/hong-kong-university-of-science-technology-guangzhou/2024/fully-funded-phd-positions-in-innovation-policy-and-entrepreneurship-thrust-society-hub-hkust-gz/226052,"about ipe thrust and phd programinnovation, policy and entrepreneurship (ipe) is an emerging interdisciplinary area that has become increasingly important in recent years in addressing global challenges in governance and provision of private and p..."
phd position : selective gas sensors platform for premature diagnostic of lung cancer (cdd : 36 months),mines saint-étienne,France,Published 1 week ago,PhD,https://academicpositions.com/ad/mines-saint-etienne/2024/phd-position-selective-gas-sensors-platform-for-premature-diagnostic-of-lung-cancer-cdd-36-months/226054,"centre de recherche spin, ecole des mines de saint etienne job environment: institut mines-télécom is the leading public group of engineering and management grandes écoles in france. consisting of eight public graduate grandes écoles and two subsi..."
doctoral (phd) student position in cognitive neuroscience,karolinska institutet,Sweden,Published 1 week ago,PhD,https://academicpositions.com/ad/karolinska-institutet/2024/doctoral-phd-student-position-in-cognitive-neuroscience/226063,do you want to contribute to top quality medical research? to be a doctoral student means to devote oneself to a research project under supervision of experienced researchers and following an indiv...
"doctoral scholarship holder in the field of gastroenterology, mucin biology and omics",university of antwerp,Belgium,Published 1 week ago,PhD,https://academicpositions.com/ad/university-of-antwerp/2024/doctoral-scholarship-holder-in-the-field-of-gastroenterology-mucin-biology-and-omics/226067,"let’s shape the future - university of antwerpthe university of antwerp is a dynamic, forward-thinking, european university. we offer an innovative academic education to more than 20000 students, c..."
"phd candidate: computational cognitive neuroscience – multisensory perceptual inference, learning and attention",radboud university,The netherlands,Published 5 days ago,PhD,https://academicpositions.com/ad/radboud-university/2024/phd-candidate-computational-cognitive-neuroscience-multisensory-perceptual-inference-learning-and-attention/226239,"employment 1.0 ftegross monthly salary € 2,872 - € 3,670required background research university degreeorganizational unit faculty of scienceapplication deadline 23 december 2024are you fascinated by how the brain makes sense of the senses in a com..."
phd student in computational biology,university of gothenburg,Sweden,Published 5 days ago,PhD,https://academicpositions.com/ad/university-of-gothenburg/2024/phd-student-in-computational-biology/226242,the university of gothenburg tackles society’s challenges with diverse knowledge. 56 000 students and 6 600 employees make the university a large and inspiring place to work and study. strong research and attractive study programmes attract resear...
phd position in the area of quantitative in situ electron microscopy of metal halide perovskite nanocrystals,university of antwerp,Belgium,Published 5 days ago,PhD,https://academicpositions.com/ad/university-of-antwerp/2024/phd-position-in-the-area-of-quantitative-in-situ-electron-microscopy-of-metal-halide-perovskite-nanocrystals/226249,"let’s shape the future - university of antwerpthe university of antwerp is a dynamic, forward-thinking, european university. we offer an innovative academic education to more than 20000 students, c..."
phd researcher on risk management in information system supply chains,ku leuven,Belgium,Published 5 days ago,PhD,https://academicpositions.com/ad/ku-leuven/2024/phd-researcher-on-risk-management-in-information-system-supply-chains/226251,"liris, the ku leuven research center on information systems engineering, is part of the department of decision sciences and information management of the faculty of economics and business (feb). th..."
phd-student positions in finance,university of luxembourg,Luxembourg,Published 4 days ago,PhD,https://academicpositions.com/ad/university-of-luxembourg/2024/phd-student-positions-in-finance/226284,"about the fdefthe university of luxembourg is an international research university with a distinctly multilingual and interdisciplinary character.the faculty of law, economics and finance (fdef) at..."
phd student (f/m/div) energy transfers in the atmosphere,leibniz-institute of atmospheric physics (iap),Germany,Published 4 days ago,PhD,https://academicpositions.com/ad/leibniz-institute-of-atmospheric-physics-iap/2024/phd-student-f-m-div-energy-transfers-in-the-atmosphere/226287,"job advertisement 2024-21 at the leibniz institute of atmospheric physics (iap), the department “modelling of atmospheric processes“ offers a position as phd student (f/m/div) energy transfers in the atmosphere the position is offered for three ye..."
phd student (f/m/div) exploring atmospheric dynamics with maarsy-3d,leibniz-institute of atmospheric physics (iap),Germany,Published 4 days ago,PhD,https://academicpositions.com/ad/leibniz-institute-of-atmospheric-physics-iap/2024/phd-student-f-m-div-exploring-atmospheric-dynamics-with-maarsy-3d/226288,"job advertisement 2024-19at the leibniz institute of atmospheric physics (iap), a part-time position (75%) in the department “radar remote sensing” is available asphd student (f/m/div) exploring atmospheric dynamics with maarsy-3dthe position is i..."
phd student (f/m/div) mesosphere and lower thermosphere dynamics with physics-informed machine learning approaches and simone,leibniz-institute of atmospheric physics (iap),Germany,Published 4 days ago,PhD,https://academicpositions.com/ad/leibniz-institute-of-atmospheric-physics-iap/2024/phd-student-f-m-div-mesosphere-and-lower-thermosphere-dynamics-with-physics-informed-machine-learning-approaches-and-simone/226289,"job advertisement 2024-20at the leibniz institute of atmospheric physics (iap), a part-time position (75%) in the department “radar remote sensing” is available asphd student (f/m/div) mesosphere and lower thermosphere dynamics with physics-inform..."
the ainsworth 4 foundation future leadership fellowship,the westmead institute for medical research,Australia,,,https://www.nature.com/naturecareers/job/12832742/the-ainsworth-4-foundation-future-leadership-fellowship/?LinkSource=PremiumListing,"the westmead institute for medical research (wimr) is offering a unique opportunity for an outstanding early to mid-career researcher with international experience to return to australia and establish an independent research program. this position, titled the ainsworth 4 foundation future leadership fellowship, is supported by a three-year fellowship that provides the resources and platform to drive impactful research within wimr’s translational research framework. this fellowship aligns with wimr’s strategic plan – towards 2030, where precision medicine is a core priority, and is designed to support innovative research with high potential to improve health outcomes."
"faculty positions at the center for machine learning research (cmlr), peking university","center for machine learning research (cmlr), peking university",China,,,https://www.nature.com/naturecareers/job/12831370/faculty-positions-at-the-center-for-machine-learning-research-cmlr-peking-university/?LinkSource=PremiumListing,"the center for machine learning research (cmlr) is a newly founded interdisciplinary research center at peking university. its goal is to advance machine learning-related research across a wide range of disciplines including mathematics, the sciences (physics, chemistry, biology, material science, engineering), and computer science, with an emphasis on the theoretical foundation of machine learning, new algorithms, and ai for science."
phd candidate (m/f/d): spatial metabolomics,leibniz-institut für analytische wissenschaften – isas – e.v.,Germany,,,https://www.nature.com/naturecareers/job/12832448/phd-candidate-m-f-d-spatial-metabolomics/?LinkSource=PremiumListing,"the leibniz-institut für analytische wissenschaften - isas - e. v. develops efficient analytical methods for health research. thus, it contributes to the improvement of the prevention, early diagnosis, and therapy of diseases like cardiovascular diseases, autoimmune diseases or cancer. overall, the institute strives to advance precision medicine by combining knowledge from different fields such as biology, chemistry, pharmacology, physics, and computer science. isas is a member of the leibniz association and is publicly funded by the federal republic of germany and its federal states."
phd candidate (m/f/d): analysis of microscopic biomedical images (ambiom),leibniz-institut für analytische wissenschaften – isas – e.v.,Germany,,,https://www.nature.com/naturecareers/job/12832391/phd-candidate-m-f-d-analysis-of-microscopic-biomedical-images-ambiom-/?LinkSource=PremiumListing,"the leibniz-institut für analytische wissenschaften - isas - e. v. develops efficient analytical methods for health research. thus, it contributes to the improvement of the prevention, early diagnosis, and therapy of diseases like cardiovascular diseases, autoimmune diseases or cancer. overall, the institute strives to advance precision medicine by combining knowledge from different fields such as biology, chemistry, pharmacology, physics, and computer science. isas is a member of the leibniz association and is publicly funded by the federal republic of germany and its federal states. a new project area in the institute is the development of artificial intelligence (ai) software for biomedical image analysis and building tools for ai-based software quality assurance."
head of the translational cancer research laboratory,northwell,United States,,,https://www.nature.com/naturecareers/job/12832246/head-of-the-translational-cancer-research-laboratory/?LinkSource=PremiumListing,northwell health has formed a strategic partnership with the nci-designated cancer center at cold spring harbor laboratory (cshl). the institutions are deeply committed to fostering collaborations to transform basic science discoveries into new therapies.
"doctoral positions at international max planck research school for biology and computation, berlin",max planck institute for molecular genetics (mpi-mg),Germany,,,https://www.nature.com/naturecareers/job/12831996/doctoral-positions-at-international-max-planck-research-school-for-biology-and-computation-berlin/?LinkSource=PremiumListing,"we are looking for outstanding graduates from all over the world and are delighted to provide them with the best possible conditions for their scientific careers. the graduate program imprs for biology and computation (imprs-bac) provides an interdisciplinary education for doctoral candidates at the interface of molecular life sciences and computational sciences. this is based on perspective and supervision from both ends - experimental and computational - and suits graduates with degrees in molecular biology, biochemistry, mathematics, bioinformatics or any related areas. if you have a passion for epigenetics, bioinformatics, developmental biology, mathematics, sequence analysis, gene regulation, rna biology, mechanobiology, protein biochemistry, stem cells and differentiation, statistics, molecular evolution or biophysics and want to work at the max planck institute for molecular genetics or the freie universität berlin - this is the doctoral program for you!"
phd or junior postdoc to investigate molecular mechanisms in the field immune-rejuvenation,sentcell ltd,Italy,,,https://www.nature.com/naturecareers/job/12831845/phd-or-junior-postdoc-to-investigate-molecular-mechanisms-in-the-field-immune-rejuvenation-/?LinkSource=PremiumListing,"in the compelling and unstoppable research in favor of cellular rejuvenation, sentcell ltd is looking for master/phd student or junior postdoc (the latter with felasa certificate) to investigate molecular mechanisms and innovative therapies at basis of t cell and systemic rejuvenation. the studies will be held at our new laboratory located at the toscana life sciences, within the gsk campus, in siena, italy."
phd studentship in analytical chemistry,urban lab at national tsing hua university,Taiwan,,,https://www.nature.com/naturecareers/job/12831721/phd-studentship-in-analytical-chemistry/?LinkSource=PremiumListing,urban lab invites applications for phd studentship in analytical chemistry.
faculty (open rank) - bioengineering and immunoengineering,"university of chicago, pritzker school of molecular engineering",United States,,,https://www.nature.com/naturecareers/job/12831452/faculty-open-rank-bioengineering-and-immunoengineering/?LinkSource=PremiumListing,"the pritzker school of molecular engineering (pme) at the university of chicago invites applications for multiple faculty positions (open rank) in bioengineering and immunoengineering at both the assistant professor and associate/full professor levels. the pme is a unique interdisciplinary school with significant strengths in immunoengineering, quantum engineering, and advanced materials engineering. we are interested in expanding our research themes into new areas in bioengineering and systems biology, broadly defined."
20 phd positions in msca doctoral network natprime: effective delivery of nats via nanocarriers,the university of warwick -natprime,Belgium,,,https://www.nature.com/naturecareers/job/12831083/20-phd-positions-in-msca-doctoral-network-natprime-effective-delivery-of-nats-via-nanocarriers/?LinkSource=PremiumListing,20 fully funded phd positions in msca doctoral network natprime: effective delivery of nucleic acid therapeutics via designed nanocarriers
postdoc and phd positions in computational neuroscience,ghent university - department of information technology - waves,Belgium,,,https://www.nature.com/naturecareers/job/12830865/postdoc-and-phd-positions-in-computational-neuroscience/?LinkSource=PremiumListing,postdoc and phd positions on closed-loop ultrasound neuromodulation and recording for the treatment of focal epilepsy
