Title,Employer,Location,Published,Job Type,URL,Description
"phd in economics, accounting, finance or management at berlin school of economics",berlin school of economics,Germany,Published 1 month ago,PhD,https://academicpositions.com/ad/berlin-school-of-economics/2024/phd-in-economics-accounting-finance-or-management-at-berlin-school-of-economics/225162,"the berlin school of economics offers career development programs in economics, accounting, finance and management at the phd and postdoc levels in a single and unique structure. eight major institutions active in economics research in the berlin-..."
"research scientist, doctoral researcher",natural resources institute finland (luke),Finland,Published 3 days ago,PhD,https://academicpositions.com/ad/natural-resources-institute-finland-luke/2024/research-scientist-doctoral-researcher/226317,we seek a phd researcher for a research project on identifying and isolating microorganisms that utilize rare earth elements. this role offers a chance to advance your scientific career under the mentorship of leading experts in the field.the ice-...
doctoral researcher in multidisciplinary research of the integration of technology with healthcare education,university of oulu,Finland,Published 1 month ago,PhD,https://academicpositions.com/ad/university-of-oulu/2024/doctoral-researcher-in-multidisciplinary-research-of-the-integration-of-technology-with-healthcare-education/225181,"the university of oulu is a multidisciplinary, international research university, with about 3,600 employees who produce new knowledge based on high-standards research and provide research based ed..."
phd position in systems and hardware security,eth zürich,Switzerland,Published 1 month ago,PhD,https://academicpositions.com/ad/eth-zurich/2024/phd-position-in-systems-and-hardware-security/225193,phd position in systems and hardware securitythe computer security group is a research group in the department of information technology and electrical engineering at eth zürich. we are interested ...
phd position – new synthesis methods and production of polymers and membranes for aem fuel cells and electrolyzers,forschungszentrum jülich gmbh,Germany,Published 3 days ago,PhD,https://academicpositions.com/ad/forschungszentrum-julich/2024/phd-position-new-synthesis-methods-and-production-of-polymers-and-membranes-for-aem-fuel-cells-and-electrolyzers/226318,would you like to contribute to the energy transition in germany through your work? then the helmholtz institute erlangen-nürnberg (for renewable energy) (hi ern) is the right place for you! the hi ern forms the core of the close partnership betwe...
doctoral researcher or postdoctoral researcher (translational pathology),university of turku,Finland,Published 3 days ago,PhD,https://academicpositions.com/ad/university-of-turku/2024/doctoral-researcher-or-postdoctoral-researcher-translational-pathology/226315,we are looking for a highly motivated doctoral researcher or postdoctoral researcher to join a project that explores the pathogenic mechanisms of familial dilated cardiomyopathy. the project is led...
phd research fellow in ict – convergence of artificial intelligence and blockchain technology,university of agder (uia),Norway,Published 1 month ago,PhD,https://academicpositions.com/ad/university-of-agder-uia/2024/phd-research-fellow-in-ict-convergence-of-artificial-intelligence-and-blockchain-technology/225202,about the positionthe university of agder invites applications for a full-time fixed-term appointment as phd candidate in technology/information and communication technology for a period of three years. the position is currently located in grimsta...
"phd position in clinical epidemiology, public health and health systems 60%- 100%",university of basel,Switzerland,Published 4 weeks ago,PhD,https://academicpositions.com/ad/university-of-basel/2024/phd-position-in-clinical-epidemiology-public-health-and-health-systems-60-100/225214,"the university of basel has an international reputation of outstanding achievements in research and teaching. founded in 1460, it is the oldest university in switzerland and has a history of succes..."
phd (4 years) on experimental testing of composites for hydrogen tanks,ghent university,Belgium,Published 4 weeks ago,PhD,https://academicpositions.com/ad/ghent-university/2024/phd-4-years-on-experimental-testing-of-composites-for-hydrogen-tanks/225217,"belgium has been taking a leading position in the transition towards a hydrogen economy thanks to many companies and research institutes active in hydrogen technologies. in addition, belgium has currently the second largest hydrogen pipeline netwo..."
phd (4 years) on micromechanical testing and interface characterization of composites,ghent university,Belgium,Published 4 weeks ago,PhD,https://academicpositions.com/ad/ghent-university/2024/phd-4-years-on-micromechanical-testing-and-interface-characterization-of-composites/225219,we are looking for a phd student for a research project on microscale mechanical characterization of fiber reinforced polymer composites using in-situ microscopic techniques. much more fundamental insights and measurements at the micro-scale are n...
phd (4 years) on structural health monitoring of composite hydrogen tanks using guided elastic waves,ghent university,Belgium,Published 4 weeks ago,PhD,https://academicpositions.com/ad/ghent-university/2024/phd-4-years-on-structural-health-monitoring-of-composite-hydrogen-tanks-using-guided-elastic-waves/225220,ugent-mms is partner in a large research project with several leading companies in the automotive industry. this research project aims at developing composite solutions for future hydrogen storage tanks. this phd vacancy is focused on the use of g...
phd/postdoc (4 years) on experimental and numerical study of textile-based armor for blast and fragment protection,ghent university,Belgium,Published 4 weeks ago,PhD,https://academicpositions.com/ad/ghent-university/2024/phd-postdoc-4-years-on-experimental-and-numerical-study-of-textile-based-armor-for-blast-and-fragment-protection/225221,"ballistic protection concerns apparel, vests, armors, helmets and structural reinforcement for vehicles as well. woven, knitted or nonwoven fabrics, laminates, and composites are an interesting option for ballistic protection because of their ligh..."
"doctoral fellow - department of translation, interpreting and communication",ghent university,Belgium,Published 4 weeks ago,PhD,https://academicpositions.com/ad/ghent-university/2024/doctoral-fellow-department-of-translation-interpreting-and-communication/225240,"last application date dec 02, 2024 00:00department lw22 - department of translation, interpreting and communicationcontract limited durationdegree maoccupancy rate 100%vacancy type research staffjob descriptionyour jobthe doctoral fellow will be e..."
research assistant (phd position) (f/m/d) in the graduate program phoqs future,university of paderborn,Germany,Published 4 weeks ago,PhD,https://academicpositions.com/ad/university-of-paderborn/2024/research-assistant-phd-position-f-m-d-in-the-graduate-program-phoqs-future/225241,"paderborn university is a high-performance and internationally oriented university. within interdisciplinary teams, we undertake forward-looking research, design innovative teaching concepts and actively transfer knowledge into society. as an impo..."
three-year phd position in neurosciences: pathogenic mechanisms in alzheimer's disease,aix-marseille université,France,Published 6 days ago,PhD,https://academicpositions.com/ad/aix-marseille-universite/2024/three-year-phd-position-in-neurosciences-pathogenic-mechanisms-in-alzheimers-disease/226190,researcher profile: phd/ r1: first stage researcher research field(s)1: biology - neurosciencesmain sub research field or disciplines1: biology - neurosciencesjob /offer description a 3-year full-time doctoral position is availabl...
phd position - structural analysis and optimisation of fully-recycled concrete structures,eth zürich,Switzerland,Published 3 weeks ago,PhD,https://academicpositions.com/ad/eth-zurich/2024/phd-position-structural-analysis-and-optimisation-of-fully-recycled-concrete-structures/225281,"phd position - structural analysis and optimisation of fully-recycled concrete structuresgreenhouse gas (ghg) emissions from material extraction, manufacturing of construction products, as well as ..."
phd position - development of a computational infrastructure for the cross-disciplinary design of fully-recycled concrete structures,eth zürich,Switzerland,Published 3 weeks ago,PhD,https://academicpositions.com/ad/eth-zurich/2024/phd-position-development-of-a-computational-infrastructure-for-the-cross-disciplinary-design-of-fully-recycled-concrete-structures/225282,"phd position - development of a computational infrastructure for the cross-disciplinary design of fully-recycled concrete structuresgreenhouse gas (ghg) emissions from material extraction, manufact..."
phd position: reversibility of dispersion and emulsion structure and functionality upon drying / redispersion,ku leuven,Belgium,Published 3 weeks ago,PhD,https://academicpositions.com/ad/ku-leuven/2024/phd-position-reversibility-of-dispersion-and-emulsion-structure-and-functionality-upon-drying-redispersion/225286,"the aim of the soft matter, rheology and technology (smart) division is to foster and conduct research on soft matter and the rheology of complex fluids on a fundamental level as well as their appl..."
5 phd positions at the norwegian school of economics,nhh norwegian school of economics,Norway,Published 3 weeks ago,PhD,https://academicpositions.com/ad/norwegian-school-of-economics-nhh/2024/5-phd-positions-at-the-norwegian-school-of-economics/225288,"nhh norwegian school of economics is pleased to announce 5 phd vacancies within the following areas: (1) accounting and auditing, (2) economics, (3) business and management science, (4) strategy and management and (5) finance. candidates admitted ..."
"phd candidate (1,0 fte) or postdoctoral researcher (1,0 fte) in ancient central asian (tarim basin)",leiden university,The netherlands,Published 3 weeks ago,PhD,https://academicpositions.com/ad/leiden-university/2024/phd-candidate-1-0-fte-or-postdoctoral-researcher-1-0-fte-in-ancient-central-asian-tarim-basin/225289,"vacancy number 15257job type phd positionshours (in fte) 1,0external/ internal externallocation leidenplaced on 5 november 2024closing date 3 december 2024 leiden university, faculty of humanities, leiden university centre for linguistics (lucl), ..."
"phd candidate (1,0 fte) or postdoctoral researcher (1,0 fte) in central asian (tarim basin) palaeogr",leiden university,The netherlands,Published 3 weeks ago,PhD,https://academicpositions.com/ad/leiden-university/2024/phd-candidate-1-0-fte-or-postdoctoral-researcher-1-0-fte-in-central-asian-tarim-basin-palaeogr/225290,"vacancy number 15258job type phd positionshours (in fte) 1,0external/ internal externallocation leidenplaced on 5 november 2024closing date 3 december 2024leiden university, faculty of humanities, leiden university centre for linguistics (lucl), i..."
phd position: ai for monitoring and prognostics of power electronics converters,eindhoven university of technology,The netherlands,Published 3 weeks ago,PhD,https://academicpositions.com/ad/eindhoven-university-of-technology/2024/phd-position-ai-for-monitoring-and-prognostics-of-power-electronics-converters/225294,"position phd-studentirène curie fellowship nodepartment(s) electrical engineeringfte 1,0date off 08/12/2024reference number v36.7853job descriptionbackgroundpower electronics converters (pecs) are systems that process electric power in various app..."
phd in carbon membranes development,eindhoven university of technology,The netherlands,Published 3 weeks ago,PhD,https://academicpositions.com/ad/eindhoven-university-of-technology/2024/phd-in-carbon-membranes-development/225295,"position phd-studentirène curie fellowship nodepartment(s) chemical engineering and chemistryfte 1,0date off 08/12/2024reference number v37.7855job descriptionfor a recently awarded european phd research grant (hermes project) we are looking for a..."
phd machine learning on large databases for interventional cardiac pci treatment,eindhoven university of technology,The netherlands,Published 3 weeks ago,PhD,https://academicpositions.com/ad/eindhoven-university-of-technology/2024/phd-machine-learning-on-large-databases-for-interventional-cardiac-pci-treatment/225297,"position phd-studentirène curie fellowship nodepartment(s) electrical engineeringfte 1,0date off 30/12/2024reference number v36.7852job descriptionproject description:background and motivationthe time delay between medically relevant innovations a..."
ph.d. position on compression-dominant 3d-printed concrete structural systems for buildings,empa,Switzerland,Published 3 weeks ago,PhD,https://academicpositions.com/ad/empa/2024/phd-position-on-compression-dominant-3d-printed-concrete-structural-systems-for-buildings/225301,"materials science and technology are our passion. with our cutting-edge research, empa's around 1,100 employees make essential contributions to the well-being of society for a future worth living. ..."
"phd research fellow in information, library, and archival studies",oslomet – oslo metropolitan university,Norway,Published 3 weeks ago,PhD,https://academicpositions.com/ad/oslo-metropolitan-university/2024/phd-research-fellow-in-information-library-and-archival-studies/225306,"the department of archivistics, library and information science has a 3-year fixed-term position available as a phd research fellow in information, library, and archival studies, a specialization u..."
phd position in biophysics at the university of twente,university of twente,The netherlands,Published 3 weeks ago,PhD,https://academicpositions.com/ad/university-of-twente/2024/phd-position-in-biophysics-at-the-university-of-twente/225308,"job descriptionjoin the nbp group, a multidisciplinary team at the university of twente, where physics, chemistry and biology converge. we are dedicated to understanding intrinsically disordered pr..."
doctoral program in finance,university of geneva,Switzerland,Published 3 weeks ago,PhD,https://academicpositions.com/ad/university-of-geneva/2024/doctoral-program-in-finance/225319,the geneva finance research institute (gfri) at the university of geneva offers annually up to three fully funded doctoral positions in a five-year ph.d. program for excellent students with research aspirations. the program covers the cost of livi...
"doctoral researcher (2 positions), electrical engineering (building decentralized, distributed and local micro-grids for decarbonization electrification challenge - ideal4green-project)",university of vaasa,Finland,Published 3 weeks ago,PhD,https://academicpositions.com/ad/university-of-vaasa/2024/doctoral-researcher-2-positions-electrical-engineering-building-decentralized-distributed-and-local-micro-grids-for-decarbonization-electrification-challenge-ideal4green-project/225334,"the university of vaasa creates an inspiring environment for meaningful work as part of a thriving and diverse university community. our open-minded, multidisciplinary research responds to the challenges of our time and creates a more responsible ..."
"doctoral researcher (polymer chemistry, physical organic chemistry, self-assembled systems, drug delivery)",tampere university,Finland,Published 3 weeks ago,PhD,https://academicpositions.com/ad/tampere-university/2024/doctoral-researcher-polymer-chemistry-physical-organic-chemistry-self-assembled-systems-drug-delivery/225341,"tampere university and tampere university of applied sciences create a unique environment for multidisciplinary, inspirational and high-impact research and education. our universities community has its competitive edges in technology, health and s..."
phd position in multi-scale modelling and simulation of polymer and antiferromagnet composites,norwegian university of science and technology (ntnu),Norway,Published 3 weeks ago,PhD,https://academicpositions.com/ad/norwegian-university-of-science-and-technology/2024/phd-position-in-multi-scale-modelling-and-simulation-of-polymer-and-antiferromagnet-composites/225348,"about the jobwe have an open phd position in multi-scale modeling and simulations of polymer and antiferromagnet (afm) composites for spintronics at the department of manufacturing and civil engineering, ntnu.spintronics, which manipulates the mag..."
doctoral appointment in biology,karlstad university,Sweden,Published 3 weeks ago,PhD,https://academicpositions.com/ad/karlstad-university/2024/doctoral-appointment-in-biology/225353,sapere aude—dare to be wise—is our motto. our students and employees develop knowledge and expertise that enrich both people and the world around them. our academic environment is characterised by ...
doctoral scholarship holder computer vision for biomedical inspection.,university of antwerp,Belgium,Published 3 weeks ago,PhD,https://academicpositions.com/ad/university-of-antwerp/2024/doctoral-scholarship-holder-computer-vision-for-biomedical-inspection/225355,"let’s shape the future - university of antwerpthe university of antwerp is a dynamic, forward-thinking, european university. we offer an innovative academic education to more than 20000 students, c..."
2 phd positions are available on the erc project: computational modelling of tangible objects on multisensory interfaces - tango,université catholique de louvain,Belgium,Published 3 weeks ago,PhD,https://academicpositions.com/ad/universite-catholique-de-louvain/2024/2-phd-positions-are-available-on-the-erc-project-computational-modelling-of-tangible-objects-on-multisensory-interfaces-tango/225360,supervisor: dr. david gueorguiev2 phd positions are available on the erc project: computational modelling of tangible objects on multisensory interfaces - tango -the project:current interactive systems provide realistic audio-visual feedback while...
doctoral student in sustainable scaling of seaweed production and processing,kth royal institute of technology,Sweden,Published 3 weeks ago,PhD,https://academicpositions.com/ad/kth-royal-institute-of-technology/2024/doctoral-student-in-sustainable-scaling-of-seaweed-production-and-processing/225361,project descriptionthird-cycle subject: industrial ecologythis phd project is a collaborative knowledge exchange initiative between sweden (kth royal institute of technology and the formas-funded b...
phd position on quantum sensing of biomolecules and their chemical stimuli (p2403) 100%,university of basel,Switzerland,Published 4 days ago,PhD,https://academicpositions.com/ad/university-of-basel/2024/phd-position-on-quantum-sensing-of-biomolecules-and-their-chemical-stimuli-p2403-100/226257,"for the prestigious phd school of the swiss nanoscience institute (sni), we solicit applications for a paid 4-year phd student position in the biomolecular nano-dynamics group at the dept. of chemi..."
doctoral students in wireless networks with large ai models,kth royal institute of technology,Sweden,Published 3 weeks ago,PhD,https://academicpositions.com/ad/kth-royal-institute-of-technology/2024/doctoral-students-in-wireless-networks-with-large-ai-models/225364,"project descriptionthird-cycle subject: electrical engineeringwith the development of computing and communication technologies, and emerging data-driven applications, e.g., iot based intelligent sy..."
doctoral student in programming languages and large language models,kth royal institute of technology,Sweden,Published 3 weeks ago,PhD,https://academicpositions.com/ad/kth-royal-institute-of-technology/2024/doctoral-student-in-programming-languages-and-large-language-models/225367,"project descriptionthird-cycle subject: information and communication technologythe doctoral student position focuses on fundamental research combining programming languages theory, compilers, and ..."
doctoral student in auvs for optimizing use of ocean spaces,kth royal institute of technology,Sweden,Published 3 weeks ago,PhD,https://academicpositions.com/ad/kth-royal-institute-of-technology/2024/doctoral-student-in-auvs-for-optimizing-use-of-ocean-spaces/225368,"project descriptionthird-cycle subject: vehicle and maritime engineeringkth royal institute of technology is part of blue food – centre for the future of seafood, a nationally funded initiative aim..."
doctoral student in critical cartography and spatial analysis,kth royal institute of technology,Sweden,Published 3 weeks ago,PhD,https://academicpositions.com/ad/kth-royal-institute-of-technology/2024/doctoral-student-in-critical-cartography-and-spatial-analysis/225370,"project descriptionthird-cycle subject: architecturein this project, you will develop spatial analysis and mapping as knowledge challenges from a critical cartography and mapping perspective – how ..."
ph.d position in sustainable energy materials,kth royal institute of technology,Sweden,Published 3 weeks ago,PhD,https://academicpositions.com/ad/kth-royal-institute-of-technology/2024/phd-position-in-sustainable-energy-materials/225374,"project descriptionthird-cycle subject: applied physicsthe light & matter physics division conducts both fundamental and applied research across multitude scientific fields, with a strong focus on ..."
doctoral student in soil and rock mechanics (climate adaption),kth royal institute of technology,Sweden,Published 3 weeks ago,PhD,https://academicpositions.com/ad/kth-royal-institute-of-technology/2024/doctoral-student-in-soil-and-rock-mechanics-climate-adaption/225375,project descriptionthird-cycle subject: civil and architectural engineering (specialization in soil and rock mechanics)we are seeking a doctoral student to join the division of soil and rock mechan...
doctoral students in large language model inferencing,kth royal institute of technology,Sweden,Published 3 weeks ago,PhD,https://academicpositions.com/ad/kth-royal-institute-of-technology/2024/doctoral-students-in-large-language-model-inferencing/225376,"project descriptionthird-cycle subject: computer sciencethe advertised doctoral student positions are within an ambitious, 5-year wallenberg scholar project titled “scalable and adaptive inferencin..."
doctoral student in physical chemistry & environmental chemistry,kth royal institute of technology,Sweden,Published 3 weeks ago,PhD,https://academicpositions.com/ad/kth-royal-institute-of-technology/2024/doctoral-student-in-physical-chemistry-environmental-chemistry/225379,project descriptionthird-cycle subject: chemistrydetection of criegee intermediates and investigation of their reactions in earth’s atmospherethe composition of earth’s atmosphere and its ability t...
doctoral student in theoretical condensed matter physics,kth royal institute of technology,Sweden,Published 3 weeks ago,PhD,https://academicpositions.com/ad/kth-royal-institute-of-technology/2024/doctoral-student-in-theoretical-condensed-matter-physics/225381,project descriptionthird-cycle subject: physicsthe group of egor babaev at the department of physics of kth royal institute of technology has an opening for two doctoral students in the field of t...
doctoral student in membrane integration/intensification for crm recovery,kth royal institute of technology,Sweden,Published 3 weeks ago,PhD,https://academicpositions.com/ad/kth-royal-institute-of-technology/2024/doctoral-student-in-membrane-integrationintensification-for-crm-recovery/225383,"project descriptionthird-cycle subject: chemical science and engineeringthis doctoral position is offered by the division of resource recovery, within the department of chemical engineering. our re..."
doctoral student in crystallization for crm recovery,kth royal institute of technology,Sweden,Published 3 weeks ago,PhD,https://academicpositions.com/ad/kth-royal-institute-of-technology/2024/doctoral-student-in-crystallization-for-crm-recovery/225384,"project descriptionthird-cycle subject: che chemical science and engineeringthis doctoral position is offered by the division of resource recovery, within the department of chemical engineering. ou..."
phd position on data-driven healthcare models for pandemic preparation,university of twente,The netherlands,Published 4 days ago,PhD,https://academicpositions.com/ad/university-of-twente/2024/phd-position-on-data-driven-healthcare-models-for-pandemic-preparation/226258,"job descriptionaccess to care is a fundamental human right to be maintained even during a health crisis. pandemics, large outbreaks of infectious diseases such as influenza, or outbreaks of high-co..."
2 doctoral positions in latin and greek literature,university of basel,Switzerland,Published 3 weeks ago,PhD,https://academicpositions.com/ad/university-of-basel/2024/2-doctoral-positions-in-latin-and-greek-literature/225411,"the department of ancient civilizations is home to all disciplines within the faculty of humanities and social sciences concerned with the ancient world (archaeology, history, literature). the depa..."
phd position,university of basel,Switzerland,Published 3 weeks ago,PhD,https://academicpositions.com/ad/university-of-basel/2024/phd-position/225412,the department of biomedicine is a joint effort between the university of basel and the university hospitals basel. it unites basic and clinical scientists to advance our understanding of health an...
phd candidate physics-informed neural networks for multi-hazard modelling,university of twente,The netherlands,Published 3 weeks ago,PhD,https://academicpositions.com/ad/university-of-twente/2024/phd-candidate-physics-informed-neural-networks-for-multi-hazard-modelling/225413,"job descriptionnatural hazards such as earthquakes, floods, and landslides pose significant risks to human populations, infrastructure, and ecosystems. these hazards rarely occur in isolation; they..."
